{
  "metadata": {
    "scan_id": "scan-632fbb2389e8",
    "scanner_version": "1.0.0",
    "ruleset_version": "2026.08.1",
    "schema_version": "1.0.0",
    "runtime": "Python 3.13.1 (darwin)",
    "container_image": null,
    "started_at": "2026-08-31T18:05:00.127699Z",
    "completed_at": "2026-08-31T18:05:02.880247Z",
    "config": {
      "timeout_seconds": 10.0,
      "max_redirects": 10,
      "fail_on": "high",
      "user_agent": "RequestTrace/1.0 (+https://github.com/requesttrace/requesttrace)",
      "certificate_warning_days": 30,
      "certificate_critical_days": 7
    }
  },
  "target": {
    "raw_input": "https://example.com",
    "scheme": "https",
    "host": "example.com",
    "port": 443,
    "path": "/",
    "query": "",
    "normalized_url": "https://example.com/",
    "is_ip_literal": false
  },
  "observations": [
    {
      "observation_id": "obs-adeab17d529e",
      "module": "dns",
      "type": "a_records",
      "value": [
        "104.20.23.154",
        "172.66.147.243"
      ],
      "timestamp": "2026-08-31T18:05:00.219860Z",
      "confidence": "observed",
      "metadata": {
        "duration_ms": 89.85102599763195,
        "record_type": "A"
      }
    },
    {
      "observation_id": "obs-07f30ea92030",
      "module": "dns",
      "type": "aaaa_records",
      "value": [
        "2606:4700:10::6814:179a",
        "2606:4700:10::ac42:93f3"
      ],
      "timestamp": "2026-08-31T18:05:00.308651Z",
      "confidence": "observed",
      "metadata": {
        "duration_ms": 88.66768200095976,
        "record_type": "AAAA"
      }
    },
    {
      "observation_id": "obs-b219855afc8a",
      "module": "dns",
      "type": "ns_records",
      "value": [
        "elliott.ns.cloudflare.com",
        "hera.ns.cloudflare.com"
      ],
      "timestamp": "2026-08-31T18:05:00.409188Z",
      "confidence": "observed",
      "metadata": {}
    },
    {
      "observation_id": "obs-1efac4bc7bb5",
      "module": "connectivity",
      "type": "tcp_connection",
      "value": {
        "selected_ip": "104.20.23.154",
        "port": 443,
        "address_family": "IPv4"
      },
      "timestamp": "2026-08-31T18:05:00.650633Z",
      "confidence": "observed",
      "metadata": {}
    },
    {
      "observation_id": "obs-367f8ecfd84d",
      "module": "tls",
      "type": "sni",
      "value": "example.com",
      "timestamp": "2026-08-31T18:05:00.948570Z",
      "confidence": "observed",
      "metadata": {}
    },
    {
      "observation_id": "obs-4929d91add88",
      "module": "tls",
      "type": "negotiated_protocol",
      "value": "TLSv1.3",
      "timestamp": "2026-08-31T18:05:00.948643Z",
      "confidence": "observed",
      "metadata": {}
    },
    {
      "observation_id": "obs-0d3b20bff6a8",
      "module": "tls",
      "type": "negotiated_cipher",
      "value": {
        "name": "TLS_AES_256_GCM_SHA384",
        "protocol": "TLSv1.3",
        "bits": 256
      },
      "timestamp": "2026-08-31T18:05:00.948684Z",
      "confidence": "observed",
      "metadata": {}
    },
    {
      "observation_id": "obs-9da7179be437",
      "module": "tls",
      "type": "alpn_protocol",
      "value": "h2",
      "timestamp": "2026-08-31T18:05:00.948718Z",
      "confidence": "observed",
      "metadata": {}
    },
    {
      "observation_id": "obs-da1cc333ee5b",
      "module": "tls",
      "type": "handshake_duration_ms",
      "value": 294.73,
      "timestamp": "2026-08-31T18:05:00.948750Z",
      "confidence": "observed",
      "metadata": {}
    },
    {
      "observation_id": "obs-8ad6964be70c",
      "module": "tls",
      "type": "certificate",
      "value": {
        "subject": "CN=example.com",
        "issuer": "CN=Cloudflare TLS Issuing ECC CA 3,O=SSL Corporation,C=US",
        "subject_alternative_names": [
          "example.com",
          "*.example.com"
        ],
        "not_valid_before": "2026-07-29T22:10:08+00:00",
        "not_valid_after": "2026-10-27T22:17:21+00:00",
        "days_remaining": 57,
        "fingerprint_sha256": "6153a96fd1a6ab7f4d438fc34932484299d0729d9140b3a126bb2f9c07b02200",
        "signature_algorithm": "ecdsa-with-SHA256",
        "public_key_algorithm": "EC (secp256r1)",
        "public_key_size_bits": 256
      },
      "timestamp": "2026-08-31T18:05:00.951791Z",
      "confidence": "observed",
      "metadata": {}
    },
    {
      "observation_id": "obs-53b98cb0db3b",
      "module": "tls",
      "type": "hostname_match",
      "value": {
        "matches": true,
        "matched_name": "example.com"
      },
      "timestamp": "2026-08-31T18:05:00.952497Z",
      "confidence": "observed",
      "metadata": {}
    },
    {
      "observation_id": "obs-2cdd218ff539",
      "module": "tls",
      "type": "trust_chain_valid",
      "value": true,
      "timestamp": "2026-08-31T18:05:01.241621Z",
      "confidence": "observed",
      "metadata": {
        "failure_category": null
      }
    },
    {
      "observation_id": "obs-b9b707899e6b",
      "module": "tls",
      "type": "protocol_support",
      "value": {
        "TLS 1.0": {
          "tested": true,
          "supported": false,
          "reason": "[SSL: NO_PROTOCOLS_AVAILABLE] no protocols available (_ssl.c:1018)",
          "note": "Local OpenSSL security policy may also reject this legacy protocol independent of server support."
        },
        "TLS 1.1": {
          "tested": true,
          "supported": false,
          "reason": "[SSL: NO_PROTOCOLS_AVAILABLE] no protocols available (_ssl.c:1018)",
          "note": "Local OpenSSL security policy may also reject this legacy protocol independent of server support."
        },
        "TLS 1.2": {
          "tested": true,
          "supported": true,
          "reason": null
        },
        "TLS 1.3": {
          "tested": true,
          "supported": true,
          "reason": null
        }
      },
      "timestamp": "2026-08-31T18:05:02.186184Z",
      "confidence": "observed",
      "metadata": {}
    },
    {
      "observation_id": "obs-8c7cd372950d",
      "module": "redirects",
      "type": "redirect_chain",
      "value": [
        {
          "url": "https://example.com/",
          "status_code": 200,
          "location": null,
          "scheme": "https"
        }
      ],
      "timestamp": "2026-08-31T18:05:02.623730Z",
      "confidence": "observed",
      "metadata": {
        "hop_count": 1
      }
    },
    {
      "observation_id": "obs-8cff2ad288f5",
      "module": "redirects",
      "type": "redirect_loop_detected",
      "value": false,
      "timestamp": "2026-08-31T18:05:02.623787Z",
      "confidence": "observed",
      "metadata": {}
    },
    {
      "observation_id": "obs-5d40e9790e7e",
      "module": "redirects",
      "type": "https_to_http_downgrade_detected",
      "value": false,
      "timestamp": "2026-08-31T18:05:02.623826Z",
      "confidence": "observed",
      "metadata": {}
    },
    {
      "observation_id": "obs-da816554e0f7",
      "module": "http",
      "type": "final_url",
      "value": "https://example.com/",
      "timestamp": "2026-08-31T18:05:02.623889Z",
      "confidence": "observed",
      "metadata": {}
    },
    {
      "observation_id": "obs-0296601d2c12",
      "module": "http",
      "type": "status_code",
      "value": 200,
      "timestamp": "2026-08-31T18:05:02.623937Z",
      "confidence": "observed",
      "metadata": {}
    },
    {
      "observation_id": "obs-53783e063758",
      "module": "http",
      "type": "http_version",
      "value": "HTTP/1.1",
      "timestamp": "2026-08-31T18:05:02.623970Z",
      "confidence": "observed",
      "metadata": {}
    },
    {
      "observation_id": "obs-8daa7e619b69",
      "module": "http",
      "type": "content_type",
      "value": "text/html",
      "timestamp": "2026-08-31T18:05:02.624004Z",
      "confidence": "observed",
      "metadata": {}
    },
    {
      "observation_id": "obs-32ee254b7938",
      "module": "http",
      "type": "ttfb_ms",
      "value": 425.95,
      "timestamp": "2026-08-31T18:05:02.624037Z",
      "confidence": "observed",
      "metadata": {}
    },
    {
      "observation_id": "obs-dceba3848bb1",
      "module": "http",
      "type": "total_duration_ms",
      "value": 437.25,
      "timestamp": "2026-08-31T18:05:02.624068Z",
      "confidence": "observed",
      "metadata": {}
    },
    {
      "observation_id": "obs-722173b3970b",
      "module": "http",
      "type": "response_headers",
      "value": {
        "Date": "Mon, 31 Aug 2026 18:05:03 GMT",
        "Content-Type": "text/html",
        "Transfer-Encoding": "chunked",
        "Connection": "keep-alive",
        "Server": "cloudflare",
        "last-modified": "Mon, 31 Aug 2026 04:09:32 GMT",
        "allow": "GET, HEAD",
        "Age": "3042",
        "cf-cache-status": "HIT",
        "Content-Encoding": "gzip",
        "CF-RAY": "a33df60df8530e74-AMS"
      },
      "timestamp": "2026-08-31T18:05:02.624097Z",
      "confidence": "observed",
      "metadata": {}
    },
    {
      "observation_id": "obs-2f344a21378d",
      "module": "headers",
      "type": "hsts",
      "value": {
        "present": false,
        "raw": null,
        "max_age": null,
        "include_subdomains": false,
        "preload": false
      },
      "timestamp": "2026-08-31T18:05:02.624154Z",
      "confidence": "observed",
      "metadata": {}
    },
    {
      "observation_id": "obs-c52627ddf298",
      "module": "headers",
      "type": "content_security_policy",
      "value": {
        "present": false,
        "raw": null,
        "high_risk_patterns": []
      },
      "timestamp": "2026-08-31T18:05:02.624202Z",
      "confidence": "observed",
      "metadata": {}
    },
    {
      "observation_id": "obs-bf3584c6918a",
      "module": "headers",
      "type": "x_content_type_options",
      "value": {
        "present": false,
        "value": null,
        "valid_nosniff": false
      },